### ISSUE TITLE
[Bug]: Suddenly unable to work

### ISSUE THREAD

**Issue by wuwo1952368901** [gravitl/netmaker#3183]
### What happened?

Suddenly unable to ping between nodes.

### Version

v0.24.2

### Contributing guidelines

- [X] Yes, I did.

**Comment by wuwo1952368901** [comment]
After running normally for a period of time, some nodes may experience ping failure. The netclient service needs to be restarted before it can be restored, but after a period of recovery, there may be issues with the system. How can we investigate the specific cause? @afeiszli

**Comment by wuwo1952368901** [comment]
Debian
debian_version：12.7
kernel： Linux  6.1.0-26-amd64 #1 SMP PREEMPT_DYNAMIC Debian 6.1.112-1 (2024-09-30) x86_64 GNU/Linux

**Comment by yabinma** [comment]
> They are not behind NAT.
> 
> OS:
> 
> ```
>   Debian
>   debian_version：12.7
>   kernel： Linux  6.1.0-26-amd64 #1 SMP PREEMPT_DYNAMIC Debian 6.1.112-1 (2024-09-30) x86_64 GNU/Linux
> 
>   Debian
>   debian_version：12.4
>   kernel： Linux  6.1.0-17-amd64 #1 SMP PREEMPT_DYNAMIC Debian 6.1.69-1 (2023-12-30) x86_64 GNU/Linux
> ```

When the issue happened,   there are several places to check usually:
1.  `wg` command to check if the target host ip in the peer list.
2.  `journalctl -u netclient > ./netclient.log`   import the netclient log and check if any error or what may be doing at the time when the issue occurs.
3.  Maybe it's worth of checking the system log if there is anything unusual at the time being.

**Comment by wuwo1952368901** [comment]
> > They are not behind NAT.
> > OS:
> > ```
> >   Debian
> >   debian_version：12.7
> >   kernel： Linux  6.1.0-26-amd64 #1 SMP PREEMPT_DYNAMIC Debian 6.1.112-1 (2024-09-30) x86_64 GNU/Linux
> > 
> >   Debian
> >   debian_version：12.4
> >   kernel： Linux  6.1.0-17-amd64 #1 SMP PREEMPT_DYNAMIC Debian 6.1.69-1 (2023-12-30) x86_64 GNU/Linux
> > ```
> 
> When the issue happened, there are several places to check usually:
> 
> 1. `wg` command to check if the target host ip in the peer list.
> 2. `journalctl -u netclient > ./netclient.log`   import the netclient log and check if any error or what may be doing at the time when the issue occurs.
> 3. Maybe it's worth of checking the system log if there is anything unusual at the time being.

Through the wg command, I found that the endpoint IP of the peer is incorrect. It automatically obtained the network IP of my k8s cluster.

```
peer: publickey
  endpoint: 10.42.6.133:51821
  allowed ips: 10.103.0.6/32
  transfer: 0 B received, 4.47 MiB sent
  persistent keepalive: every 20 seconds

peer: publickey
  endpoint: 10.42.9.197:51821
  allowed ips: 10.103.0.9/32
  transfer: 0 B received, 4.60 MiB sent
  persistent keepalive: every 20 seconds
```

**Comment by yabinma** [comment]
> > > They are not behind NAT.
> > > OS:
> > > ```
> > >   Debian
> > >   debian_version：12.7
> > >   kernel： Linux  6.1.0-26-amd64 #1 SMP PREEMPT_DYNAMIC Debian 6.1.112-1 (2024-09-30) x86_64 GNU/Linux
> > > 
> > >   Debian
> > >   debian_version：12.4
> > >   kernel： Linux  6.1.0-17-amd64 #1 SMP PREEMPT_DYNAMIC Debian 6.1.69-1 (2023-12-30) x86_64 GNU/Linux
> > > ```
> > 
> > 
> > When the issue happened, there are several places to check usually:
> > 
> > 1. `wg` command to check if the target host ip in the peer list.
> > 2. `journalctl -u netclient > ./netclient.log`   import the netclient log and check if any error or what may be doing at the time when the issue occurs.
> > 3. Maybe it's worth of checking the system log if there is anything unusual at the time being.
> 
> Through the wg command, I found that the endpoint IP of the peer is incorrect. It automatically obtained the network IP of my k8s cluster.
> 
> ```
> peer: publickey
>   endpoint: 10.42.6.133:51821
>   allowed ips: 10.103.0.6/32
>   transfer: 0 B received, 4.47 MiB sent
>   persistent keepalive: every 20 seconds
> 
> peer: publickey
>   endpoint: 10.42.9.197:51821
>   allowed ips: 10.103.0.9/32
>   transfer: 0 B received, 4.60 MiB sent
>   persistent keepalive: every 20 seconds
> ```

Auto Endpoint detection is enabled by default. So that the hosts are able to communicate each other with internal ip if they are in the same sub network.

In your setup,  the host could not communicate each other with the network IP of k8s cluster. 
Or you may disable the auto endpoint detection.  In netmaker.env,   set `ENDPOINT_DETECTION=false` and restart the containers with `docker compose down & docker compose up -d`

**Comment by wuwo1952368901** [comment]
I also encounter sudden inability to ping when deploying with Wireguard. I know this issue has nothing to do with Netmaker, but I have never known what caused it. I hope someone who understands can provide some troubleshooting ideas. Thank you!

**Comment by wuwo1952368901** [comment]
After synchronizing the configuration through "netclient pull", the node still cannot ping. Use the "wg show" command to check for the following:

```
interface: netmaker
  public key: publickey
  private key: (hidden)
  listening port: 51821

peer: publickey
  endpoint: xxx.xxx.xxx.xxx:51821
  allowed ips: 10.104.0.4/32
  latest handshake: 1 minute, 3 seconds ago
  transfer: 209.23 KiB received, 143.68 KiB sent
  persistent keepalive: every 20 seconds

peer: publickey
  endpoint: xxx.xxx.xxx.xxx:51821
  allowed ips: 10.104.0.3/32
  latest handshake: 1 minute, 35 seconds ago
  transfer: 5.31 MiB received, 958.77 KiB sent
  persistent keepalive: every 20 seconds

peer: publickey
  endpoint: xxx.xxx.xxx.xxx:51821
  allowed ips: 10.104.0.5/32
  transfer: 0 B received, 39.17 KiB sent
  persistent keepalive: every 20 seconds

peer: publickey
  endpoint: xxx.xxx.xxx.xxx:51821
  allowed ips: 10.104.0.2/32
  transfer: 0 B received, 39.31 KiB sent
  persistent keepalive: every 20 seconds

```


The last two nodes cannot be pinged properly. The wg show command shows that the problematic nodes do not have a "latest handshake".

@yabinma @afeiszli

**Comment by abhishek9686** [comment]
> 10.104.0.5
Hi,
can share the output of `wg show` of this peer `10.104.0.5`

**Comment by wuwo1952368901** [comment]
> > 10.104.0.5
> > Hi,
> > can share the output of `wg show` of this peer `10.104.0.5`

This is the information for the "wg show" on 10.104.0.5:


```
interface: netmaker
  public key: publickey
  private key: (hidden)
  listening port: 51821

peer: publickey
  endpoint: xxx.xxx.xxx.xxx:51821
  allowed ips: 10.104.0.4/32
  latest handshake: 1 minute, 11 seconds ago
  transfer: 11.06 MiB received, 56.23 MiB sent
  persistent keepalive: every 20 seconds

peer: publickey
  endpoint: xxx.xxx.xxx.xxx:51821
  allowed ips: 10.104.0.3/32
  latest handshake: 1 minute, 21 seconds ago
  transfer: 368.95 MiB received, 321.13 MiB sent
  persistent keepalive: every 20 seconds

peer: publickey
  endpoint: xxx.xxx.xxx.xxx:51821
  allowed ips: 10.104.0.2/32
  transfer: 0 B received, 489.67 KiB sent
  persistent keepalive: every 20 seconds

peer: publickey
  endpoint: xxx.xxx.xxx.xxx:51821
  allowed ips: 10.104.0.1/32
  transfer: 0 B received, 465.68 KiB sent
  persistent keepalive: every 20 seconds
```

**Comment by wuwo1952368901** [comment]
Through tcpdump packet capture, it was found that the netmaker network card has packets, but the external network card does not have packets. The commands are as follows (all of which are operated on peer 10.104.0.1):

```
tcpdump -i netmaker host 10.104.0.2 and icmp
tcpdump: verbose output suppressed, use -v[v]... for full protocol decode
listening on netmaker, link-type RAW (Raw IP), snapshot length 262144 bytes
12:18:18.400768 IP 10.104.0.1 > 10.104.0.2: ICMP echo request, id 24016, seq 616, length 64
12:18:19.424768 IP 10.104.0.1 > 10.104.0.2: ICMP echo request, id 24016, seq 617, length 64
12:18:20.448792 IP 10.104.0.1 > 10.104.0.2: ICMP echo request, id 24016, seq 618, length 64
12:18:21.472789 IP 10.104.0.1 > 10.104.0.2: ICMP echo request, id 24016, seq 619, length 64
12:18:22.496784 IP 10.104.0.1 > 10.104.0.2: ICMP echo request, id 24016, seq 620, length 64
12:18:23.520791 IP 10.104.0.1 > 10.104.0.2: ICMP echo request, id 24016, seq 621, length 64
12:18:24.544723 IP 10.104.0.1 > 10.104.0.2: ICMP echo request, id 24016, seq 622, length 64
12:18:25.568768 IP 10.104.0.1 > 10.104.0.2: ICMP echo request, id 24016, seq 623, length 64
12:18:26.592790 IP 10.104.0.1 > 10.104.0.2: ICMP echo request, id 24016, seq 624, length 64
12:18:27.616776 IP 10.104.0.1 > 10.104.0.2: ICMP echo request, id 24016, seq 625, length 64
12:18:28.640789 IP 10.104.0.1 > 10.104.0.2: ICMP echo request, id 24016, seq 626, length 64
12:18:29.664798 IP 10.104.0.1 > 10.104.0.2: ICMP echo request, id 24016, seq 627, length 64
12:18:30.688800 IP 10.104.0.1 > 10.104.0.2: ICMP echo request, id 24016, seq 628, length 64
12:18:31.712777 IP 10.104.0.1 > 10.104.0.2: ICMP echo request, id 24016, seq 629, length 64
```

```
tcpdump -i eth0 host xxx.xxx.xxx.xxx
tcpdump: verbose output suppressed, use -v[v]... for full protocol decode
listening on eth0, link-type EN10MB (Ethernet), snapshot length 262144 bytes
12:18:14.305050 IP peer.10.104.0.1.51821 > peer.10.104.0.2.51821: UDP, length 148
12:18:19.328962 IP peer.10.104.0.1.51821 > peer.10.104.0.2.51821: UDP, length 148
12:18:24.545006 IP peer.10.104.0.1.51821 > peer.10.104.0.2.51821: UDP, length 148
12:18:29.665054 IP peer.10.104.0.1.51821 > peer.10.104.0.2.51821: UDP, length 148
```

**Comment by abhishek9686** [comment]
> Through tcpdump packet capture, it was found that the netmaker network card has packets, but the external network card does not have packets. The commands are as follows (all of which are operated on peer 10.104.0.1):
> 
> ```
> tcpdump -i netmaker host 10.104.0.2 and icmp
> tcpdump: verbose output suppressed, use -v[v]... for full protocol decode
> listening on netmaker, link-type RAW (Raw IP), snapshot length 262144 bytes
> 12:18:18.400768 IP 10.104.0.1 > 10.104.0.2: ICMP echo request, id 24016, seq 616, length 64
> 12:18:19.424768 IP 10.104.0.1 > 10.104.0.2: ICMP echo request, id 24016, seq 617, length 64
> 12:18:20.448792 IP 10.104.0.1 > 10.104.0.2: ICMP echo request, id 24016, seq 618, length 64
> 12:18:21.472789 IP 10.104.0.1 > 10.104.0.2: ICMP echo request, id 24016, seq 619, length 64
> 12:18:22.496784 IP 10.104.0.1 > 10.104.0.2: ICMP echo request, id 24016, seq 620, length 64
> 12:18:23.520791 IP 10.104.0.1 > 10.104.0.2: ICMP echo request, id 24016, seq 621, length 64
> 12:18:24.544723 IP 10.104.0.1 > 10.104.0.2: ICMP echo request, id 24016, seq 622, length 64
> 12:18:25.568768 IP 10.104.0.1 > 10.104.0.2: ICMP echo request, id 24016, seq 623, length 64
> 12:18:26.592790 IP 10.104.0.1 > 10.104.0.2: ICMP echo request, id 24016, seq 624, length 64
> 12:18:27.616776 IP 10.104.0.1 > 10.104.0.2: ICMP echo request, id 24016, seq 625, length 64
> 12:18:28.640789 IP 10.104.0.1 > 10.104.0.2: ICMP echo request, id 24016, seq 626, length 64
> 12:18:29.664798 IP 10.104.0.1 > 10.104.0.2: ICMP echo request, id 24016, seq 627, length 64
> 12:18:30.688800 IP 10.104.0.1 > 10.104.0.2: ICMP echo request, id 24016, seq 628, length 64
> 12:18:31.712777 IP 10.104.0.1 > 10.104.0.2: ICMP echo request, id 24016, seq 629, length 64
> ```
> 
> ```
> tcpdump -i eth0 host xxx.xxx.xxx.xxx
> tcpdump: verbose output suppressed, use -v[v]... for full protocol decode
> listening on eth0, link-type EN10MB (Ethernet), snapshot length 262144 bytes
> 12:18:14.305050 IP peer.10.104.0.1.51821 > peer.10.104.0.2.51821: UDP, length 148
> 12:18:19.328962 IP peer.10.104.0.1.51821 > peer.10.104.0.2.51821: UDP, length 148
> 12:18:24.545006 IP peer.10.104.0.1.51821 > peer.10.104.0.2.51821: UDP, length 148
> 12:18:29.665054 IP peer.10.104.0.1.51821 > peer.10.104.0.2.51821: UDP, length 148
> ```

can you share your network diagram?

**Comment by wuwo1952368901** [comment]
> > Through tcpdump packet capture, it was found that the netmaker network card has packets, but the external network card does not have packets. The commands are as follows (all of which are operated on peer 10.104.0.1):
> > ```
> > tcpdump -i netmaker host 10.104.0.2 and icmp
> > tcpdump: verbose output suppressed, use -v[v]... for full protocol decode
> > listening on netmaker, link-type RAW (Raw IP), snapshot length 262144 bytes
> > 12:18:18.400768 IP 10.104.0.1 > 10.104.0.2: ICMP echo request, id 24016, seq 616, length 64
> > 12:18:19.424768 IP 10.104.0.1 > 10.104.0.2: ICMP echo request, id 24016, seq 617, length 64
> > 12:18:20.448792 IP 10.104.0.1 > 10.104.0.2: ICMP echo request, id 24016, seq 618, length 64
> > 12:18:21.472789 IP 10.104.0.1 > 10.104.0.2: ICMP echo request, id 24016, seq 619, length 64
> > 12:18:22.496784 IP 10.104.0.1 > 10.104.0.2: ICMP echo request, id 24016, seq 620, length 64
> > 12:18:23.520791 IP 10.104.0.1 > 10.104.0.2: ICMP echo request, id 24016, seq 621, length 64
> > 12:18:24.544723 IP 10.104.0.1 > 10.104.0.2: ICMP echo request, id 24016, seq 622, length 64
> > 12:18:25.568768 IP 10.104.0.1 > 10.104.0.2: ICMP echo request, id 24016, seq 623, length 64
> > 12:18:26.592790 IP 10.104.0.1 > 10.104.0.2: ICMP echo request, id 24016, seq 624, length 64
> > 12:18:27.616776 IP 10.104.0.1 > 10.104.0.2: ICMP echo request, id 24016, seq 625, length 64
> > 12:18:28.640789 IP 10.104.0.1 > 10.104.0.2: ICMP echo request, id 24016, seq 626, length 64
> > 12:18:29.664798 IP 10.104.0.1 > 10.104.0.2: ICMP echo request, id 24016, seq 627, length 64
> > 12:18:30.688800 IP 10.104.0.1 > 10.104.0.2: ICMP echo request, id 24016, seq 628, length 64
> > 12:18:31.712777 IP 10.104.0.1 > 10.104.0.2: ICMP echo request, id 24016, seq 629, length 64
> > ```
> > 
> > 
> >     
> >       
> >     
> > 
> >       
> >     
> > 
> >     
> >   
> > ```
> > tcpdump -i eth0 host xxx.xxx.xxx.xxx
> > tcpdump: verbose output suppressed, use -v[v]... for full protocol decode
> > listening on eth0, link-type EN10MB (Ethernet), snapshot length 262144 bytes
> > 12:18:14.305050 IP peer.10.104.0.1.51821 > peer.10.104.0.2.51821: UDP, length 148
> > 12:18:19.328962 IP peer.10.104.0.1.51821 > peer.10.104.0.2.51821: UDP, length 148
> > 12:18:24.545006 IP peer.10.104.0.1.51821 > peer.10.104.0.2.51821: UDP, length 148
> > 12:18:29.665054 IP peer.10.104.0.1.51821 > peer.10.104.0.2.51821: UDP, length 148
> > ```
> 
> can you share your network diagram?

Is this what you want?


![image](https://github.com/user-attachments/assets/ac74f8a6-bee6-4723-b68d-d6263cf38f12)

**Comment by yabinma** [comment]
> > > 10.104.0.5
> > > Hi,
> > > can share the output of `wg show` of this peer `10.104.0.5`
> 
> This is the information for the "wg show" on 10.104.0.5:
> 
> ```
> interface: netmaker
>   public key: publickey
>   private key: (hidden)
>   listening port: 51821
> 
> peer: publickey
>   endpoint: xxx.xxx.xxx.xxx:51821
>   allowed ips: 10.104.0.4/32
>   latest handshake: 1 minute, 11 seconds ago
>   transfer: 11.06 MiB received, 56.23 MiB sent
>   persistent keepalive: every 20 seconds
> 
> peer: publickey
>   endpoint: xxx.xxx.xxx.xxx:51821
>   allowed ips: 10.104.0.3/32
>   latest handshake: 1 minute, 21 seconds ago
>   transfer: 368.95 MiB received, 321.13 MiB sent
>   persistent keepalive: every 20 seconds
> 
> peer: publickey
>   endpoint: xxx.xxx.xxx.xxx:51821
>   allowed ips: 10.104.0.2/32
>   transfer: 0 B received, 489.67 KiB sent
>   persistent keepalive: every 20 seconds
> 
> peer: publickey
>   endpoint: xxx.xxx.xxx.xxx:51821
>   allowed ips: 10.104.0.1/32
>   transfer: 0 B received, 465.68 KiB sent
>   persistent keepalive: every 20 seconds
> ```

@wuwo1952368901 , in the case,  let's take an example,   10.104.0.1  could not ping 10.104.0.5 each other.

1. How the hosts on 10.104.0.1 and 10.104.0.5 are connected?  At least they are able to ping each other via eth0, right?  Any firewall or NAT between them?
2. On 10.104.0.5,  what's the output for command `traceroute -I 10.104.0.1`?

**Comment by wuwo1952368901** [comment]
> > > > 10.104.0.5
> > > > Hi,
> > > > can share the output of `wg show` of this peer `10.104.0.5`
> > 
> > 
> > This is the information for the "wg show" on 10.104.0.5:
> > ```
> > interface: netmaker
> >   public key: publickey
> >   private key: (hidden)
> >   listening port: 51821
> > 
> > peer: publickey
> >   endpoint: xxx.xxx.xxx.xxx:51821
> >   allowed ips: 10.104.0.4/32
> >   latest handshake: 1 minute, 11 seconds ago
> >   transfer: 11.06 MiB received, 56.23 MiB sent
> >   persistent keepalive: every 20 seconds
> > 
> > peer: publickey
> >   endpoint: xxx.xxx.xxx.xxx:51821
> >   allowed ips: 10.104.0.3/32
> >   latest handshake: 1 minute, 21 seconds ago
> >   transfer: 368.95 MiB received, 321.13 MiB sent
> >   persistent keepalive: every 20 seconds
> > 
> > peer: publickey
> >   endpoint: xxx.xxx.xxx.xxx:51821
> >   allowed ips: 10.104.0.2/32
> >   transfer: 0 B received, 489.67 KiB sent
> >   persistent keepalive: every 20 seconds
> > 
> > peer: publickey
> >   endpoint: xxx.xxx.xxx.xxx:51821
> >   allowed ips: 10.104.0.1/32
> >   transfer: 0 B received, 465.68 KiB sent
> >   persistent keepalive: every 20 seconds
> > ```
> 
> @wuwo1952368901 , in the case, let's take an example, 10.104.0.1 could not ping 10.104.0.5 each other.
> 
> 1. How the hosts on 10.104.0.1 and 10.104.0.5 are connected?  At least they are able to ping each other via eth0, right?  Any firewall or NAT between them?
> 2. On 10.104.0.5,  what's the output for command `traceroute -I 10.104.0.1`?






> 1. How the hosts on 10.104.0.1 and 10.104.0.5 are connected?  At least they are able to ping each other via eth0, right?  Any firewall or NAT between them?

1.  10.104.0.1 and 10.104.0.5 are within the same local area network, and both machines have their own proprietary public IP addresses.

2.  The networks of 10.104.0.1 and 10.104.0.5 are interconnected (both public and local networks are interconnected)

3.  10.104.0.1 and 10.104.0.5 are normal at the beginning of networking, but the problem of disconnection only occurs after running for a period of time.



> 2. On 10.104.0.5,  what's the output for command `traceroute -I 10.104.0.1`?

```
traceroute -I 10.104.0.1
traceroute to 10.104.0.1 (10.104.0.1), 30 hops max, 60 byte packets
 1  * * *
 2  * * *
 3  * * *
 4  * * *
 5  * * *
 6  * * *
 7  * * *
 8  * * *
 9  * * *
10  * * *
11  * * *
12  * * *
13  * * *
14  * * *
15  * * *
16  * * *
17  * * *
18  * * *
19  * * *
20  * * *
21  * * *
22  * * *
23  * * *
24  * * *
25  * * *
26  * * *
27  * * *
28  * * *
29  * * *
30  * * *

```

**Comment by yabinma** [comment]
> > > > > 10.104.0.5
> > > > > Hi,
> > > > > can share the output of `wg show` of this peer `10.104.0.5`
> > > 
> > > 
> > > This is the information for the "wg show" on 10.104.0.5:
> > > ```
> > > interface: netmaker
> > >   public key: publickey
> > >   private key: (hidden)
> > >   listening port: 51821
> > > 
> > > peer: publickey
> > >   endpoint: xxx.xxx.xxx.xxx:51821
> > >   allowed ips: 10.104.0.4/32
> > >   latest handshake: 1 minute, 11 seconds ago
> > >   transfer: 11.06 MiB received, 56.23 MiB sent
> > >   persistent keepalive: every 20 seconds
> > > 
> > > peer: publickey
> > >   endpoint: xxx.xxx.xxx.xxx:51821
> > >   allowed ips: 10.104.0.3/32
> > >   latest handshake: 1 minute, 21 seconds ago
> > >   transfer: 368.95 MiB received, 321.13 MiB sent
> > >   persistent keepalive: every 20 seconds
> > > 
> > > peer: publickey
> > >   endpoint: xxx.xxx.xxx.xxx:51821
> > >   allowed ips: 10.104.0.2/32
> > >   transfer: 0 B received, 489.67 KiB sent
> > >   persistent keepalive: every 20 seconds
> > > 
> > > peer: publickey
> > >   endpoint: xxx.xxx.xxx.xxx:51821
> > >   allowed ips: 10.104.0.1/32
> > >   transfer: 0 B received, 465.68 KiB sent
> > >   persistent keepalive: every 20 seconds
> > > ```
> > 
> > 
> > @wuwo1952368901 , in the case, let's take an example, 10.104.0.1 could not ping 10.104.0.5 each other.
> > 
> > 1. How the hosts on 10.104.0.1 and 10.104.0.5 are connected?  At least they are able to ping each other via eth0, right?  Any firewall or NAT between them?
> > 2. On 10.104.0.5,  what's the output for command `traceroute -I 10.104.0.1`?
> 
> 1. How the hosts on 10.104.0.1 and 10.104.0.5 are connected?  At least they are able to ping each other via eth0, right?  Any firewall or NAT between them?
>    a.  10.104.0.1 and 10.104.0.5 are within the same local area network, and both machines have their own proprietary public IP addresses.
>    b.  The networks of 10.104.0.1 and 10.104.0.5 are interconnected (both public and local networks are interconnected)
>    c.  10.104.0.1 and 10.104.0.5 are normal at the beginning of networking, but the problem of disconnection only occurs after running for a period of time.
> 2. On 10.104.0.5,  what's the output for command `traceroute -I 10.104.0.1`?
> 
> ```
> traceroute -I 10.104.0.1
> traceroute to 10.104.0.1 (10.104.0.1), 30 hops max, 60 byte packets
>  1  * * *
>  2  * * *
>  3  * * *
>  4  * * *
>  5  * * *
>  6  * * *
>  7  * * *
>  8  * * *
>  9  * * *
> 10  * * *
> 11  * * *
> 12  * * *
> 13  * * *
> 14  * * *
> 15  * * *
> 16  * * *
> 17  * * *
> 18  * * *
> 19  * * *
> 20  * * *
> 21  * * *
> 22  * * *
> 23  * * *
> 24  * * *
> 25  * * *
> 26  * * *
> 27  * * *
> 28  * * *
> 29  * * *
> 30  * * *
> ```

@wuwo1952368901 , in your reply,  `The networks of 10.104.0.1 and 10.104.0.5 are interconnected (both public and local networks are interconnected)`,  I assume 10.104.0.1 and 10.104.0.5 hosts are able to ping with both of local and public ips and there is not any access control(port forbidden etc.). 

From the traceroute output, the ping package does not reach any of other nodes. It looks like something is not correct  in local. 
Can you please share the route table in local? with command `route -n` (on both of 10.104.0.1 and 10.104.0.5).
